[
  {
    "id": "57f671b3-53d1-57a8-9140-32dd43ef4153",
    "keyword": "boundary_kw",
    "category": "BoundCat",
    "geo": "ES-MD",
    "window_start": "2023-10-02",
    "window_end": "2023-10-08",
    "interest_avg": 80.0,
    "delta_pct": 0.0,
    "direction": "flat",
    "rank": 1,
    "confidence": "low",
    "snapshot_ids": [
      "55555555-5555-5555-5555-555555555555"
    ],
    "computed_at": "2023-11-20T12:00:00Z"
  },
  {
    "id": "f3e55be1-200d-562b-8c0e-7601e3b9b2c8",
    "keyword": "gap_kw",
    "category": "GapCat",
    "geo": "ES-MD",
    "window_start": "2023-10-02",
    "window_end": "2023-10-08",
    "interest_avg": 30.0,
    "delta_pct": 0.0,
    "direction": "flat",
    "rank": 2,
    "confidence": "low",
    "snapshot_ids": [
      "44444444-4444-4444-4444-444444444444"
    ],
    "computed_at": "2023-11-20T12:00:00Z"
  },
  {
    "id": "10097958-90af-5448-b7b2-de3b4587cd25",
    "keyword": "high_kw",
    "category": "HighCat",
    "geo": "ES-MD",
    "window_start": "2023-10-02",
    "window_end": "2023-10-08",
    "interest_avg": 20.0,
    "delta_pct": 0.0,
    "direction": "flat",
    "rank": 3,
    "confidence": "low",
    "snapshot_ids": [
      "11111111-1111-1111-1111-111111111111"
    ],
    "computed_at": "2023-11-20T12:00:00Z"
  },
  {
    "id": "242dae20-3a01-5d05-bcaa-6e726d10b40b",
    "keyword": "boundary_kw",
    "category": "BoundCat",
    "geo": "ES-MD",
    "window_start": "2023-10-09",
    "window_end": "2023-10-15",
    "interest_avg": 92.0,
    "delta_pct": 15.0,
    "direction": "rising",
    "rank": 1,
    "confidence": "low",
    "snapshot_ids": [
      "55555555-5555-5555-5555-555555555555"
    ],
    "computed_at": "2023-11-20T12:00:00Z"
  },
  {
    "id": "ab3964af-2db2-5807-b738-0e536495e294",
    "keyword": "gap_kw",
    "category": "GapCat",
    "geo": "ES-MD",
    "window_start": "2023-10-09",
    "window_end": "2023-10-15",
    "interest_avg": 30.0,
    "delta_pct": 0.0,
    "direction": "flat",
    "rank": 2,
    "confidence": "low",
    "snapshot_ids": [
      "44444444-4444-4444-4444-444444444444"
    ],
    "computed_at": "2023-11-20T12:00:00Z"
  },
  {
    "id": "b2701fd9-1734-5d5a-9070-1eda772169f5",
    "keyword": "high_kw",
    "category": "HighCat",
    "geo": "ES-MD",
    "window_start": "2023-10-09",
    "window_end": "2023-10-15",
    "interest_avg": 21.0,
    "delta_pct": 5.0,
    "direction": "flat",
    "rank": 3,
    "confidence": "low",
    "snapshot_ids": [
      "11111111-1111-1111-1111-111111111111"
    ],
    "computed_at": "2023-11-20T12:00:00Z"
  },
  {
    "id": "bd6c57fc-0eda-59b4-9025-44f74674f22a",
    "keyword": "boundary_kw",
    "category": "BoundCat",
    "geo": "ES-MD",
    "window_start": "2023-10-16",
    "window_end": "2023-10-22",
    "interest_avg": 78.2,
    "delta_pct": -15.0,
    "direction": "falling",
    "rank": 1,
    "confidence": "low",
    "snapshot_ids": [
      "55555555-5555-5555-5555-555555555555"
    ],
    "computed_at": "2023-11-20T12:00:00Z"
  },
  {
    "id": "d5b00bb4-e587-5c02-96b5-4b1a8541f5fa",
    "keyword": "gap_kw",
    "category": "GapCat",
    "geo": "ES-MD",
    "window_start": "2023-10-16",
    "window_end": "2023-10-22",
    "interest_avg": 30.0,
    "delta_pct": 0.0,
    "direction": "flat",
    "rank": 2,
    "confidence": "low",
    "snapshot_ids": [
      "44444444-4444-4444-4444-444444444444"
    ],
    "computed_at": "2023-11-20T12:00:00Z"
  },
  {
    "id": "a4c977b3-1e0a-5af0-99ca-3756ed761f5b",
    "keyword": "high_kw",
    "category": "HighCat",
    "geo": "ES-MD",
    "window_start": "2023-10-16",
    "window_end": "2023-10-22",
    "interest_avg": 22.0,
    "delta_pct": 4.76,
    "direction": "flat",
    "rank": 3,
    "confidence": "low",
    "snapshot_ids": [
      "11111111-1111-1111-1111-111111111111"
    ],
    "computed_at": "2023-11-20T12:00:00Z"
  },
  {
    "id": "968e7f61-f56e-5505-ac41-0d53f107be7c",
    "keyword": "gap_kw",
    "category": "GapCat",
    "geo": "ES-MD",
    "window_start": "2023-10-23",
    "window_end": "2023-10-29",
    "interest_avg": 30.0,
    "delta_pct": 0.0,
    "direction": "flat",
    "rank": 1,
    "confidence": "low",
    "snapshot_ids": [
      "44444444-4444-4444-4444-444444444444"
    ],
    "computed_at": "2023-11-20T12:00:00Z"
  },
  {
    "id": "f7415c26-ed4b-5787-a26f-473252435cf5",
    "keyword": "high_kw",
    "category": "HighCat",
    "geo": "ES-MD",
    "window_start": "2023-10-23",
    "window_end": "2023-10-29",
    "interest_avg": 23.0,
    "delta_pct": 4.55,
    "direction": "flat",
    "rank": 2,
    "confidence": "medium",
    "snapshot_ids": [
      "11111111-1111-1111-1111-111111111111"
    ],
    "computed_at": "2023-11-20T12:00:00Z"
  },
  {
    "id": "26412bd0-a07e-59cb-ad98-4f1ecc473a23",
    "keyword": "high_kw",
    "category": "HighCat",
    "geo": "ES-MD",
    "window_start": "2023-10-30",
    "window_end": "2023-11-05",
    "interest_avg": 24.0,
    "delta_pct": 4.35,
    "direction": "flat",
    "rank": 1,
    "confidence": "medium",
    "snapshot_ids": [
      "11111111-1111-1111-1111-111111111111"
    ],
    "computed_at": "2023-11-20T12:00:00Z"
  },
  {
    "id": "13ea1750-6f3c-59e3-be9a-b9ce6a12ecff",
    "keyword": "medium_kw",
    "category": "MedCat",
    "geo": "ES-MD",
    "window_start": "2023-10-30",
    "window_end": "2023-11-05",
    "interest_avg": 15.0,
    "delta_pct": 0.0,
    "direction": "flat",
    "rank": 2,
    "confidence": "low",
    "snapshot_ids": [
      "22222222-2222-2222-2222-222222222222"
    ],
    "computed_at": "2023-11-20T12:00:00Z"
  },
  {
    "id": "6042924d-8ea2-565c-94d0-6a10f7a57e72",
    "keyword": "short_kw",
    "category": "ShortCat",
    "geo": "ES-MD",
    "window_start": "2023-11-06",
    "window_end": "2023-11-12",
    "interest_avg": 50.0,
    "delta_pct": 0.0,
    "direction": "flat",
    "rank": 1,
    "confidence": "low",
    "snapshot_ids": [
      "33333333-3333-3333-3333-333333333333"
    ],
    "computed_at": "2023-11-20T12:00:00Z"
  },
  {
    "id": "aae6a61d-de5c-5a83-a5db-b1fb342abd2b",
    "keyword": "gap_kw",
    "category": "GapCat",
    "geo": "ES-MD",
    "window_start": "2023-11-06",
    "window_end": "2023-11-12",
    "interest_avg": 30.0,
    "delta_pct": 0.0,
    "direction": "flat",
    "rank": 2,
    "confidence": "low",
    "snapshot_ids": [
      "44444444-4444-4444-4444-444444444444"
    ],
    "computed_at": "2023-11-20T12:00:00Z"
  },
  {
    "id": "34b42f38-9589-521b-8662-108e523d29ac",
    "keyword": "high_kw",
    "category": "HighCat",
    "geo": "ES-MD",
    "window_start": "2023-11-06",
    "window_end": "2023-11-12",
    "interest_avg": 28.8,
    "delta_pct": 20.0,
    "direction": "rising",
    "rank": 3,
    "confidence": "medium",
    "snapshot_ids": [
      "11111111-1111-1111-1111-111111111111"
    ],
    "computed_at": "2023-11-20T12:00:00Z"
  },
  {
    "id": "0fd09c59-fa27-5d0b-b701-b7a48869f718",
    "keyword": "medium_kw",
    "category": "MedCat",
    "geo": "ES-MD",
    "window_start": "2023-11-06",
    "window_end": "2023-11-12",
    "interest_avg": 15.0,
    "delta_pct": 0.0,
    "direction": "flat",
    "rank": 4,
    "confidence": "low",
    "snapshot_ids": [
      "22222222-2222-2222-2222-222222222222"
    ],
    "computed_at": "2023-11-20T12:00:00Z"
  },
  {
    "id": "065f5c18-bf20-5854-a117-02cc9c036a73",
    "keyword": "short_kw",
    "category": "ShortCat",
    "geo": "ES-MD",
    "window_start": "2023-11-13",
    "window_end": "2023-11-19",
    "interest_avg": 50.0,
    "delta_pct": 0.0,
    "direction": "flat",
    "rank": 1,
    "confidence": "low",
    "snapshot_ids": [
      "33333333-3333-3333-3333-333333333333"
    ],
    "computed_at": "2023-11-20T12:00:00Z"
  },
  {
    "id": "e5bf8d72-b7c8-58fc-8a11-e000ea592e35",
    "keyword": "high_kw",
    "category": "HighCat",
    "geo": "ES-MD",
    "window_start": "2023-11-13",
    "window_end": "2023-11-19",
    "interest_avg": 34.56,
    "delta_pct": 20.0,
    "direction": "rising",
    "rank": 2,
    "confidence": "medium",
    "snapshot_ids": [
      "11111111-1111-1111-1111-111111111111"
    ],
    "computed_at": "2023-11-20T12:00:00Z"
  },
  {
    "id": "70676146-c02f-5310-9126-e797140d3a88",
    "keyword": "gap_kw",
    "category": "GapCat",
    "geo": "ES-MD",
    "window_start": "2023-11-13",
    "window_end": "2023-11-19",
    "interest_avg": 30.0,
    "delta_pct": 0.0,
    "direction": "flat",
    "rank": 3,
    "confidence": "low",
    "snapshot_ids": [
      "44444444-4444-4444-4444-444444444444"
    ],
    "computed_at": "2023-11-20T12:00:00Z"
  },
  {
    "id": "b2dc236d-0e42-5bbf-af61-46ab20ac1277",
    "keyword": "medium_kw",
    "category": "MedCat",
    "geo": "ES-MD",
    "window_start": "2023-11-13",
    "window_end": "2023-11-19",
    "interest_avg": 15.0,
    "delta_pct": 0.0,
    "direction": "flat",
    "rank": 4,
    "confidence": "low",
    "snapshot_ids": [
      "22222222-2222-2222-2222-222222222222"
    ],
    "computed_at": "2023-11-20T12:00:00Z"
  },
  {
    "id": "6826ba22-3e69-55ff-a7c5-91acca70ab2b",
    "keyword": "short_kw",
    "category": "ShortCat",
    "geo": "ES-MD",
    "window_start": "2023-11-20",
    "window_end": "2023-11-26",
    "interest_avg": 50.0,
    "delta_pct": 0.0,
    "direction": "flat",
    "rank": 1,
    "confidence": "low",
    "snapshot_ids": [
      "33333333-3333-3333-3333-333333333333"
    ],
    "computed_at": "2023-11-20T12:00:00Z"
  },
  {
    "id": "4fb357f0-e7ab-5f23-a582-c1443808e507",
    "keyword": "high_kw",
    "category": "HighCat",
    "geo": "ES-MD",
    "window_start": "2023-11-20",
    "window_end": "2023-11-26",
    "interest_avg": 41.47,
    "delta_pct": 19.99,
    "direction": "rising",
    "rank": 2,
    "confidence": "high",
    "snapshot_ids": [
      "11111111-1111-1111-1111-111111111111"
    ],
    "computed_at": "2023-11-20T12:00:00Z"
  },
  {
    "id": "98797b06-71db-5208-ad78-2fcbebea1f2b",
    "keyword": "gap_kw",
    "category": "GapCat",
    "geo": "ES-MD",